<?xml version="1.0" encoding="UTF-8"?>
<xs:schema xmlns:xs="http://www.w3.org/2001/XMLSchema">
    <xs:element name="config">
        <xs:complexType>
            <xs:sequence>
                <xs:element name="alexaRouter" type="alexaRouterType" maxOccurs="unbounded" minOccurs="0">
                    <xs:unique name="alexaRouterName">
                        <xs:annotation>
                            <xs:documentation>
                                Alexa Listener name should be unique.
                            </xs:documentation>
                        </xs:annotation>
                        <xs:selector xpath="alexaRouter"/>
                        <xs:field xpath="@name"/>
                    </xs:unique>
                </xs:element>
            </xs:sequence>
        </xs:complexType>
    </xs:element>

    <xs:complexType name="alexaRouterType">
        <xs:sequence>
            <xs:element name="intent" maxOccurs="unbounded" minOccurs="0">
                <xs:complexType>
                    <xs:attribute name="value" type="xs:string"/>
                </xs:complexType>
            </xs:element>
        </xs:sequence>
        <xs:attribute name="type" type="xs:string" use="required"/>
        <xs:attribute name="name" type="xs:string" use="required"/>
        <xs:attribute name="default" type="xs:boolean"/>
    </xs:complexType>
</xs:schema>
